id,reviews,service,location,value,cleanliness,room,facilities
2852,發揮小孩的專長 老師上課細心教導,0,0,0,0,0,0
2853,大推137跟135兩間房型 老闆人很好 還會帶你去景點拍照！！,1,0,0,0,1,0
2855,老闆的服務很好,1,0,0,0,0,0
2857,人員服務非常親切,1,0,0,0,0,0
2859,早餐超級美味，員工服務讓人感受到溫暖。,1,0,0,0,0,0
2860,地理位置位在老街下方 很方便,0,1,0,0,0,0
2861,地點好，管家親切。,1,1,0,0,0,0
2862,另增加訂製油壓床，還有專業芳療師人員進駐服務,1,0,0,0,0,0
2865,老闆夫妻兩人超級好,1,0,0,0,0,0
2866,希望北部也要開,0,0,0,0,0,0
2867,老闆親切有禮，迎賓待客親切，是民宿一大優點,1,0,0,0,0,0
2872,早餐服務人員,0,0,0,0,0,0
2874,算還OK！不管是櫃台服務態度還是房間裝潢 是都還算OK適合情侶夫妻一起去,1,0,0,0,1,0
2876,床很軟，晚上會有駐唱歌手，邊喝調酒邊聽歌，心情很放鬆。,0,0,0,0,1,1
2878,老闆真的熱情，闆娘親切貼心，大推 ',1,0,0,0,0,0
2879,床的硬度睡起來很舒服。,0,0,0,0,1,0
2880,房內有管路的噪音，對聲音敏感的人較不適合,0,0,0,0,2,0
2882,早餐跟以前的落差太大,2,0,0,0,0,0
2884,老闆娘很親切，貓咪盼盼也很可愛,1,0,0,0,0,0
2885,老闆娘人很好，房間也很乾淨,1,0,0,1,1,0
2886,房間環境位置都很棒，又靠近恆春轉運站 值得推薦！  ,0,1,0,0,1,0
2887,我這次去吃二樓的中菜，是上海江浙菜（服務員說的），價位還算可以，服務也到位。,1,0,1,0,0,0
2888,房間很漂亮呢,0,0,0,0,1,0
2889,如果你還在考慮住哪，就選這裏 我不是廣告 我是102房客,0,0,0,0,0,0
2890,早餐還行~建議可以再豐富些,2,0,0,0,0,0
2894,大燈是遙控式，晚上可以直接在被窩裡熄燈，有電視可以看還有電風扇（高級的那種）、冰箱，配備都很新，最重要的是大落地窗採光非常好，居住環境很舒適、乾淨，接待人員也很親切。,1,0,0,1,1,0
2896,比較老式的一般般,0,0,0,0,0,0
2898,房間沒有小桌子化妝台可以放東西。,0,0,0,0,2,0
2900,補助，沒想到房間、環境美 價格超佛係 沒抬價回復速度快服務又好   ,0,0,1,0,1,0
2901,早餐的包子好吃,1,0,0,0,0,0
2902,老闆娘人很好很親切，東西忘記帶還幫忙寄回家，真是太感恩了！！,1,0,0,0,0,0
2903,下午茶真的很棒,1,0,0,0,0,0
2904,入住時就感覺到民宿管家的熱心，幫忙提行李至電梯口，回程也很熱心幫忙叫小黃。進到房間內非常讓人讚嘆房內佈置的小巧思好用心！盡量都佈置的像希臘風格好多幅畫和裝飾品都是地中海風格。電視螢幕很大房間算寬敞，重點房間的陽台有放置椅子可以看海，想聽海浪聲打開窗戶，一早起床映入眼簾就是七星潭海邊。晚上隔音很好沒聽到任何吵雜聲。晚上因為用餐不便但我們是叫外送app送晚餐倒也方便。整趟旅程都很滿意！很推薦,1,0,0,0,1,0
2905,民宿老闆＆老闆娘很親切熱情,1,0,0,0,0,0
2907,老板和老板娘非常親切,1,0,0,0,0,0
2911,水管隔音不佳，早餐增加選擇樣式，份量，紅茶不要用鋁箔包,2,0,0,0,2,0
2913,床頭類似的沙發裝飾有味道，枕頭顆數給的太少,0,0,0,2,2,0
2914,服務態度一級棒，房間舒適乾淨，人員親切溫暖，寵物友善，必推小琉球住宿！,1,0,0,1,1,0
2916,地點很棒，離捷運非常近,0,1,0,0,0,0
2918,招待的柚子茶很好喝 特色是有戶外泡腳池 可以和朋友一起泡腳吹風聊天 氣氛很好,1,0,0,0,0,1
2920,網路訂房，沒有附車位及早餐，現場的女服務員態度真的不優,2,0,0,0,0,2
2921,房內設計細節用心、寵物友善、民宿主人相當親切！,1,0,0,0,1,0
2922,每個房間的都有一個卡通的主題，而且都有溜滑梯，很推薦有帶小朋友的家長來這裡～,0,0,0,0,1,0
2923,老闆的好客已經是人所皆知的了，這也是民宿與飯店上最大的差異。,1,0,0,0,0,0
2932,如果有提供早餐會更棒喲！,2,0,0,0,0,0
2934,"公共空間小. 不太有機會和其他人,甚至旅宿服務人員交流",0,0,0,0,0,2
2935,老闆很親切，床鋪很乾淨、很軟，浴室很舒適。,1,0,0,1,1,0
2936,早餐宵夜。都不錯 服務人員很熱情,1,0,0,0,0,0
2937,早餐是到附近店家買的，方便購買。主人熱情，準備水果點心和泡麵，很貼心。,1,0,0,0,0,0
2939,馬桶有點漏水地板會一點點濕濕的 枕頭上黏了好多前房客的頭髮   但老闆娘很熱',1,0,0,2,2,0
2940,不錯的旅社,0,0,0,0,0,0
2941,房間冷氣壞了，整晚熱到睡不著、房間超潮濕，潮濕味道超不舒服。服務人員隔天才回訊息說會派人來檢查冷氣，都要退房了⋯熱到洗完澡滿身汗，隔天早上睡醒又在洗兩次澡⋯,2,0,0,2,2,0
2942,房內設備簡單但使用起來便利舒適。老闆回覆 line 滿快速。,1,0,0,0,1,0
2943,地點為於車站附近，走路不用1分鐘就到,0,1,0,0,0,0
2948,早餐好吃，食材豐富多元,1,0,0,0,0,0
2952,早餐很豐盛吃很飽，附近開車十分鐘內就有熱鬧商圈很方便,1,1,0,0,0,0
2954,房子空間很大，有附早餐,1,0,0,0,1,0
2955,老闆還特別開車帶我們走走去看螢火蟲 隔天的中式早餐特別好吃?? 有機會還想來住,1,0,0,0,0,0
2956,早餐多樣化 也好吃,1,0,0,0,0,0
2957,老闆親切還會推薦旅遊景點和好吃的伴手禮。看到我們有買需要冷凍的伴手禮，主動提出先幫我們冷凍,1,0,0,0,0,0
2959,服務親切，房間乾淨，地點好,1,1,0,1,1,0
2960,床被有些潮溼,0,0,0,2,2,0
2963,早餐選項多，種類豐富,1,0,0,0,0,0
2964,早餐一般的西式~還OK!!,1,0,0,0,0,0
2968,房間內掛衣服的地方太少了,0,0,0,0,2,0
2969,沒暖氣，寒流來很冷,0,0,0,0,2,0
2971,老闆娘好貼心，親自接待，還幫忙老人家換鞋子,1,0,0,0,0,0
2972,地點稍偏僻,0,2,0,0,0,0
2976,房間佈置的不錯，整體非常的乾淨舒適，浴室更是乾淨,0,0,0,1,1,0
2978,早餐麥當勞很不錯,1,0,0,0,0,0
2979,早餐能加個麥片跟牛奶會更好,2,0,0,0,0,0
2981,民宿整體相當乾淨，浴室蓮蓬頭的水力也相當夠,0,0,0,1,1,0
2983,老闆很熱情招待，很暢聊。下次會再去玩,1,0,0,0,0,0
2984,走廊跟房間的隔音有點差,0,0,0,0,2,0
2986,民宿海邊景觀非常好,0,0,0,0,1,0
2987,房間又乾淨又大，老闆娘晚上還切了水果跟香蕉給我們補充，因為明天要鐵人比賽，位置也很好就在火車站附近，旁邊就有711還有全聯（超吃驚）還有兩隻可愛的貓咪。總之非常推薦！,1,1,0,1,1,0
2993,早餐沒有飲料選項,2,0,0,0,0,0
2995,工作人員交接是不是需要加強一下？一直再跟我確認一樣的問題（真的問了3次）另外，房間的整潔需要加強，總覺得地板黏黏的,2,0,0,2,2,0
2997,住宿位置爲市中心,0,1,0,0,0,0
2998,吹風機的風太小了，吹半天都吹不乾,0,0,0,0,2,0
2999,"早餐樣式不少很有誠意及美味,餐廳人員有禮貌會向客人打招呼道早安。",1,0,0,0,0,0
3001,早餐不錯吃 位置良好離捷運站很近,1,1,0,0,0,0
3002,老闆很好～ 親切 值得推薦,1,0,0,0,0,0
3003,房內浴缸比照溫泉旅館的規格設計，可以舒服的享受泡澡時光，算是很出人意料，而其他的就中規中矩。,0,0,0,0,1,0
3004,交通超級方便，衛浴的整潔也很乾淨，服務人員的態度都還不錯，整體CP值非常高,1,1,1,1,1,0
3005,"早餐超優,老闆手藝超好,用料超好",1,0,0,0,0,0
3006,"房間整潔寬敞舒適設備完善??價格親民??附近很多景點,逛街購物餐飲交通皆方便",0,1,1,1,1,0
3007,最佳民宿，欣賞美麗安平港。,0,1,0,0,0,0
3008,1. 浴室地板會滲水，讓整間客房濕氣很重。,0,0,0,2,2,0
3009,我們來的時候跟走的時候都詢問能不能寄物，櫃檯都很客氣的說可以！,1,0,0,0,0,0
3010,地點適中，規劃很彈性,0,1,0,0,0,0
3012,空間乾淨又舒服，臨近商圈非常方便，很推薦,0,1,0,1,1,0
3016,房間有免費升級很棒，服務人員會主動詢問覺得很棒，水壓很夠,1,0,0,0,1,0
3017,床！躺上去瞬間失去意識的好睡,0,0,0,0,1,0
3018,早餐雖然種類不是很多，但精緻美味，很不錯。,1,0,0,0,0,0
3019,老闆人很好很隨和！有問題也都幫忙處理的很即時,1,0,0,0,0,0
3020,雨林餐廳菜色豐富，強推蜂蜜奇亞籽加上牛肉燴蔬菜。甜點大推西班牙冰淇淋加上可麗餅。,1,0,0,0,0,0
3021,住宿地點真的就在太魯閣的入口，非常方便，不過最好還是要自己開車前去。,0,1,0,0,0,0
3023,位置地點不錯也很方便，價格親民。,0,1,1,0,0,0
3024,床超軟；隔音不太好,0,0,0,0,2,0
3025,房間門沒辦法反鎖 是電子鎖感覺有點不安心,0,0,0,0,2,0
3026,沒有停車位 超級難找 所以覺得開車比較麻煩,0,0,0,0,0,2
3030,住宿地點很棒，離東大門夜市，花蓮市區很近，附近也有很多景點可以去逛，逛累了可以再回來休息。,0,1,0,0,0,0
3033,房間不是舒適但是早餐不錯服務品質不錯,1,0,0,0,2,0
3035,民宿業者親切熱情,1,0,0,0,0,0
3036,一晚一千塊有找，離火車站也近,0,1,1,0,0,0
3038,地點佳，好逛街，離東大門夜市很近，很喜歡。,0,1,0,0,0,0
3039,房間看出去的景色很美，室內裝潢有個性，床也不錯，很適合帶著女朋友們一起來,0,0,0,0,1,0
3041,住宿地點熱鬧 近鬧區,0,1,0,0,0,0
3042,尤其民宿主人提供的旅遊配套服務，像租車、接送、船票等，對房客的行程規劃很便利。,1,0,0,0,0,0
3043,早餐種類豐盛，沙拉新鮮，咖啡非常好喝！,1,0,0,0,0,0
3044,房間很大，附近有新城教堂，與好吃的餐廳1家,0,1,0,0,1,0
3046,床太軟，紙拖鞋不太好穿，隔音設備不佳,0,0,0,0,2,0
3047,同床有一邊已經變形,0,0,0,0,2,0
3049,可以停重機或機車，24hrs供應小點心，闆娘親切。,1,0,0,0,0,1
3051,老闆娘很熱心，而且位置很方便！,1,1,0,0,0,0
3052,早餐簡單但不錯吃，補貨速度快。,1,0,0,0,0,0
3053,1.大廳和房間的裝潢都很雅緻，可以看出主人佈置的巧思。,0,0,0,0,1,1
3054,早餐晚餐都很好，補餐快，氣分佳，不過早餐太多住客小孩亂跑有點危險，這跟你們無關。,1,0,0,0,0,0
3055,房間很大，價錢cp值很高,0,0,1,0,1,0
3056,沒有暖氣設備,0,0,0,0,2,0
3058,位置靠近捷運站很方便,0,1,0,0,0,0
3059,早餐豐富CP高,1,0,1,0,0,0
3060,地點方便，距離夜市很近,0,1,0,0,0,0
3061,房間有煙味，還聽得到隔壁的吵雜聲,0,0,0,2,2,0
3063,男主任跟早餐很好,1,0,0,0,0,0
3064,很棒的服務與設計，晚餐牛排、片皮鴨、紅酒都是上上之選，唯中式早餐小菜較無聊。,1,0,0,0,0,0
3067,房間整潔度有改善空間。停車不便。巷弄狹小。,0,0,0,2,2,2
3068,房間比較大，設備比較新。,0,0,0,0,1,0
3069,洛可可樓中樓家庭房超棒，房內空間大，且獨立陽台視野好,0,0,0,0,1,0
3070,目前的門鍊感覺不安全 拉第二次會鬆開,0,0,0,0,2,0
3071,位置很棒，離火車站近！週邊生活機能優秀！,0,1,0,0,0,0
3073,房間大，枕頭睡起來舒服,0,0,0,0,1,0
3074,早餐和每日的茶点水果精致用心，味美超赞。房间布置风格独特，典雅，轻音乐舒缓心情。一切都非常美好。,1,0,0,0,1,0
3075,住宿地點很棒 員工有笑容 服務很不錯,1,1,0,0,0,0
3077,地點太好了！,0,1,0,0,0,0
3079,房間內任何角落都非常乾淨，一點灰塵都沒有，老闆娘人很熱情也很可愛，性價比高。,1,0,1,1,1,0
3081,地点离火车站很近，很方便！附近商圈也多蛮好逛的。,0,1,0,0,0,0
3083,住宿房間裏的整體很整潔 空間很舒適,0,0,0,1,1,0
3084,老闆很耐思，給我們好多好玩好吃的建議！,1,0,0,0,0,0
3087,冷氣設備的噪音、外面的車流聲,0,0,0,0,2,0
3088,地板有點太滑，充電孔有點少,0,0,0,0,2,0
3090,房間有很重很重的霉味,0,0,0,2,2,0
3091,房間有空氣濾清器,0,0,0,0,1,0
3092,房間很美、很舒適！還提供優質的茶籽堂洗滌用品！早餐食物有質素，還提供下午茶。,1,0,0,0,1,0
3096,早餐供餐時間有點晚,2,0,0,0,0,0
3098,早餐豐富、養生，看的出主人的用心,1,0,0,0,0,0
3099,目前沒有不喜歡,0,0,0,0,0,0
3100,地點距離捷運站也有點距離，酒店沒有門牌,0,2,0,0,0,0
3101,一定要住景觀套房，夜景很美,0,0,0,0,1,0
3102,早餐很多樣選擇，地點近市中心,1,1,0,0,0,0
3103,去住的時候馬陸非常多，地板、窗簾....一直在房內出現；床太軟；安排的房間離鵝窩很近，鵝嗓門很大，很多隻叫超大聲,0,0,0,2,2,0
3104,早餐非常美味，房主有很用心的在做早餐，也会为你讲解花莲游玩的事项和为你推荐游玩路线，十分推荐，下次一定会再次入住的,1,0,0,0,0,0
3105,房間比較小,0,0,0,0,2,0
3106,老闆人很親切熱情,1,0,0,0,0,0
3108,沐浴乳太少,0,0,0,0,2,0
3109,房間乾淨安靜舒適，民宿主人親切，解說詳細。離夜市，市中心，海邊很近，適合渡假。,1,1,0,1,1,0
3111,"泳池spa池兒童遊戲區規劃不錯,早晚餐菜色多,料理多台東在地食物,唯蒼蠅有點多",1,0,0,2,0,1
3112,房間內的清潔可以再加強，在電熱水器下的櫃子看到死掉的蟑螂，廁所地板有頭髮,0,0,0,2,2,0
3113,性價比非常的高，同時又有很好的地理位置以及風景,0,1,1,0,0,0
3114,一切都不錯，老闆娘非常親切,1,0,0,0,0,0
3117,早餐很棒，房間舒適，老闆既親切又細心。,1,0,0,0,1,0
3118,非常非常喜歡 早餐是道地的美味肉粿、飯湯，還有雙糕潤！',1,0,0,0,0,0
3119,冷氣出風口太大聲,0,0,0,0,2,0
3121,可能屋齡比較大，插座數量少且舊，3C多或是需要接筆電的會不容易,0,0,0,0,2,0
3124,房間就可以看到景色 景觀很厲害 夜景好看 可惜早餐普通了一點,2,0,0,0,1,0
3125,小朋友受傷，櫃台衝去準備冰塊，很甘心。,1,0,0,0,0,0
3126,住宿地點非常方便，附近有百貨公司可逛，半夜不怕沒東西吃，距離捷運站約5分鐘，去哪都方便！,0,1,0,0,0,0
3127,服務良好.cp值很高的民宿.,1,0,1,0,0,0
3128,"早餐豐富美味,",1,0,0,0,0,0
3129,床墊比較硬，不過房價合理,0,0,1,0,2,0
3130,有固定車位,0,0,0,0,0,1
3133,我覺得自助式早餐選擇多樣化，可以吃到中式和西式早餐,1,0,0,0,0,0
3134,早餐很不錯，房間也很乾淨，舒適。,1,0,0,1,1,0
3135,MOD199電影,0,0,0,0,0,0
3136,2月13號晚上去用情人套餐業者舉辦活動一天有十位享用情人套餐就可以免費休息三個小時對我們老人家來講還蠻新鮮的還有小禮物#重點是有一位服務人員叫雅茵服務特別貼心菜單很小他馬上用手機把字放大讓我們看得更清楚,1,0,0,0,0,0
3139,隔離14天 服務態度親切 餐點充足房間稍微舊但是乾淨 雙人房窗戶大,1,0,0,1,1,0
3141,店內氛圍很好,0,0,0,0,0,0
3142,地點方便 老闆親切 房間好睡 早餐美味 五星推薦,1,1,0,0,1,0
3145,部分房型是停車場搭電梯至3樓，很特殊。,0,0,0,0,0,0
3146,地點靠近東大門夜市，交通便利,0,1,0,0,0,0
3149,床鋪很棒、地點方便，環境整潔。,0,1,0,1,1,0
3152,車開到門口，就有工作人員來關心，從CHECKIN到進房服務很週到，有尊榮感！,1,0,0,0,0,0
3154,有陽光可以進來就更棒了,0,0,0,0,2,0
3155,早餐：清粥淡菜、饅頭、西式吐司+果醬，單品咖啡機，特色：南瓜豆漿好喝！,1,0,0,0,0,0
3158,地理位置去阿里山周邊景點都很方便。 房間非常舒適整潔，任何小細節都完美。 服務人員很好聊又熱情 非常喜歡這裡。,1,1,0,1,1,0
3159,服務人員態度極差，解說超不耐煩的樣子，不會再度委任該店。,2,0,0,0,0,0
3160,免治馬桶坐上是熱的，廁所有抽風乾燥功能。床是加大。,0,0,0,0,1,0
3162,生日渡假住湖景房超美，餐飲建議要加強,2,0,0,0,1,0
3163,位子很好!走沒多遠就有商店,0,1,0,0,0,0
3164,床太軟，空調悶又大聲,0,0,0,0,2,0
3168,吹風機風量小,0,0,0,0,2,0
3169,房間佈置很舒服,0,0,0,0,1,0
3170,主人熱情客氣,1,0,0,0,0,0
3171,老闆超級親切熱心,1,0,0,0,0,0
3172,早餐很好吃，加購的晚餐也很好吃，分量足夠，能被餵飽很幸福。,1,0,0,0,0,0
3173,防疫期間變成房間送餐這部份很NICE,1,0,0,0,0,0
3175,提供中式早餐.離旗山市區又近交通算便利 值得渡假休閒去處.棒.,1,1,0,0,0,0
3176,每間房間都有一個故事 仿佛環遊世界，心中擁有一個夢想,0,0,0,0,1,0
3179,老闆家人很好，我們小孩睡著了，還幫我們搬行李上樓！,1,0,0,0,0,0
3181,一分錢一分貨，但也太破舊啦,0,0,0,0,2,0
3183,早餐內容可以再加強一點……,2,0,0,0,0,0
3184,店長很nise,1,0,0,0,0,0
3185,一點服務業的精神都沒有，爛死了！就算全台北市都沒有房間，也不會想去住  ',2,0,0,0,0,0
3186,早餐很棒 也吃的很飽,1,0,0,0,0,0
3187,民宿地點就在市區，入住前可以用官網或用line聯絡訂機車和行程，服務親切且便利！,1,1,0,0,0,0
3188,沒有停車位子,0,0,0,0,0,2
3189,"床太軟,隔音不太好",0,0,0,0,2,0
3191,早餐份量很足夠，床鋪大又舒服！,1,0,0,0,1,0
3192,民宿姊姊真的讚，很有親和力，會介紹當地旅遊資訊給遊客，入住的房間床、設施及空間都很不錯~民宿也有提供一些零食、咖啡、涼飲冷熱水給遊客免費使用，很貼心！,1,0,0,0,1,0
3193,房間大，乾淨，,0,0,0,1,1,0
3198,爛透了，早餐稀飯太稀，豆漿太稀像喝水，絕對不會來第二次,2,0,0,0,0,0
3199,我女朋友奶子很棒,0,0,0,0,0,0
3200,房間寬敞、店員服務態度很棒很可愛哈哈，還詳細帶我們一一解說。,1,0,0,0,1,0
3201,住背包客棧的民宿，隔音比較不好，如果外面有人大聲聊天，房間內都會明顯聽到,0,0,0,0,2,0
3202,沒到這邊之前真的很難想像,0,0,0,0,0,0
3203,地點可以，有免費飲料好喝，門鎖有點不太適應,1,1,0,0,2,0
3205,地點真的很棒。,0,1,0,0,0,0
3207,"冷氣好像没辦法控制温度, 一直都不冷",0,0,0,0,2,0
3209,民宿主人一家人親切又大方，房間乾淨又新，地點近便利商店及附近美食，值得再來,1,1,0,1,1,0
3210,"住宿地點離高捷很近,步行只要5分鐘",0,1,0,0,0,0
3211,老闆服務親切，住處對面就是遠東百貨，購物方便,1,1,0,0,0,0
3212,CP值很高 不錯的地方 公共區可以泡茶 聊天發呆 也很適合一群人來喔,0,0,1,0,0,1
3213,房間的硬體設備感覺得出來比較有歷史感,0,0,0,0,2,0
3214,地點真的很棒 CＰ質很告！,0,1,1,0,0,0
3217,自助式早餐很豐富，房間整潔度也不錯，飯店的服務人員也很和藹可親,1,0,0,1,1,0
3218,面對伯朗大道，田園山嵐風景超美，房間隔音不理想，但服務親切,1,1,0,0,2,0
3219,有家的感覺，第一天12點多到達花蓮才跟老公說真想提早入住休息，孕婦易累但不好意思詢問，到達民宿後老闆似乎看出我的想法，立刻說我們可以入住休息囉到達房間躺在床上看著窗戶的天空景觀...很美..很放鬆...不想出門了...入住二天早餐好吃也有變化...很挑床的我也睡的很好...軟硬適中連枕頭也好睡真心推薦何家民宿..老闆.闆娘.小幫手..人都很好唷！,1,0,0,0,1,0
3220,1.員工冷淡,2,0,0,0,0,0
3221,有特別休息的地方，還有飲料跟點心,1,0,0,0,0,1
3222,冷氣忽冷忽熱 熱水忽冷忽熱,0,0,0,0,2,0
3223,自助早餐的品項太少！,2,0,0,0,0,0
3224,房間空調太熱,0,0,0,0,2,0
3225,全天都可以使用的點心券，讓我們在12點多回到飯店還有熱騰騰的宵夜可以享用，早餐的品項也很美味豐富，房內的衛浴空間很寬敞和乾淨，備品一應俱全，非常滿意房內設施，以及飯店服務人員的服務！,1,0,0,1,1,0
3228,有來高雄都住著，但反應電視雜音影響住房品質，換來的是態度差沒辦法換房換電視,2,0,0,0,2,0
3229,地理位置不錯 離夜市挺近的,0,1,0,0,0,0
3230,"早餐真的好吃,廚藝不錯！如果有吃素的人也有素食早餐可以吃（不是只有吃土司唷！）,但要事先告知;晚餐也可以在那邊享用.住宿地點離太魯閣國家公園真的很近,附近也有小七與加油站!整體而言CP值算蠻高的！",1,1,1,0,0,0
3231,老闆親切，解說詳細。,1,0,0,0,0,0
3233,地點很好，旁邊的早餐店很好吃,0,1,0,0,0,0
3235,尚未有不滿意,0,0,0,0,0,0
3236,早餐沒有熱飲,2,0,0,0,0,0
3237,老闆很熱情，房間跟環境都很乾淨，值得再去喔！,1,0,0,1,1,0
3238,早餐很簡單也很好吃,1,0,0,0,0,0
3240,水壓有點小。,0,0,0,0,2,0
3241,"户外裸湯池,温度有稍低,太冷",0,0,0,0,0,2
3242,這是一個住起來非常舒服的一間名宿 如果以後有機會去台東 我應該還會在訂這家名宿,0,0,0,0,1,0
3246,安靜舒適的環境,0,0,0,0,1,0
3247,CP值很高，離花蓮和吉安市區近。購物用餐方便，民宿旁早餐店就有四家，隔壁還有雞排店喔！,0,1,1,0,0,0
3249,地點非常好，晚上不會吵鬧，隔音良好。老闆非常熱情提供相當周全的服務，房間裡面也整理的非常乾淨，應有盡有。很喜歡房間的格局和浴缸，住起來相當舒適。,1,1,0,1,1,0
3250,早餐老闆娘準備的超豐盛，完全超出預期的多，整個吃不完,1,0,0,0,0,0
3251,地點位在生活機能便利之處,0,1,0,0,0,0
3252,民宿老闆娘與老闆適時貼心讓人感到溫暖，完全可以感受到親切感。,1,0,0,0,0,0
3253,老板娘熱情好客，房間乾淨，令人舒爽。臨行，一雙登山鞋忘了放入車內，老板娘及管家，馬上協助處理，當日隨即寄出，令人感動。,1,0,0,1,1,0
3254,房間空間偏小，CP值不高。,0,0,2,0,2,0
3255,地點，早餐，服務態度,0,0,0,0,0,0
3256,普通大小，清晨六點就能聽到樓下噪音及隔壁不斷拖拉桌椅聲音，非常差勁住宿品質...,0,0,0,0,2,0
3257,房間很乾淨 床很舒適,0,0,0,1,1,0
3258,地下停車場滿位 需要到立體停車場停車,0,0,0,0,0,2
3259,早餐部的菜布蛋,0,0,0,0,0,0
3260,床位舒適 管家很貼心 超讚,1,0,0,0,1,0
3264,人員很nice,1,0,0,0,0,0
3266,老闆很熱情人也很好還會做周邊介紹,1,0,0,0,0,0
3267,房間有點小，行李可能需要放到日式通鋪的床板上，因可睡五人的空間只用四人，所以間距寬。訂房時已確認房間是一樓，並詢問是否會很吵，小姐回覆說不會。但當晚才知道一樓中庭四周有商家，晚上不知是房客還是店家人員一直在一樓中庭聊天，凌晨一點還不睡，還有機車騎入影響睡眠。早上七點左右商家就開門，還會放音樂。主要是這噪音干擾扣很多分。,0,0,0,0,2,0
3268,小管家Tasha Peggy 水鹿都推薦了很多地道的地方美食，咖啡廳，景點。,1,0,0,0,0,0
3270,位置方便，整潔舒適，早餐也挺豐盛的,1,1,0,1,1,0
3271,地點在市區超方便，也有洗衣機烘衣機使用,0,1,0,0,0,1
3274,"住旗艦房,按摩浴缸是壞的,蒸氣室沒有蒸氣,整個體驗就是差",0,0,0,0,2,0
3275,布置很有特色,0,0,0,0,1,0
3276,床旁邊沒有插座浴室蓮蓬頭只能拿著洗不附贈浴帽冷氣、冰箱都不冷房間wi-fi有夠爛服務1.0位置1.0客房1.0,2,2,0,0,2,0
3277,民宿老闆和闆娘待人親和，會幫忙介紹哪裡有好吃的，住宿價格也是親民到揪甘心。,1,0,1,0,0,0
3280,床 棒透了,0,0,0,0,1,0
3281,"住宿的地點,不管去有名的小吃店,用走的就可以,很方便的地理位置,在吃的的方面完全不用擔心,都可以找到好吃的東西,公正小籠包,花蓮夜市等等很好好吃的,都可以到...",0,1,0,0,0,0
3284,夜間檢修電梯，造成客房停電，是美中不足之處。,0,0,0,0,0,2
3285,民宿主人待人和善,1,0,0,0,0,0
3286,check in後出門，晚上8點多到隔天11點前退房都沒看到員工，本來有些問題還有想寄行李都不知找誰,2,0,0,0,0,0
3288,周邊吃的東西很少,0,2,0,0,0,0
3289,早餐很好吃！還想在嚐嚐！！！老闆娘很親切，有機會還會想在住。,1,0,0,0,0,0
3290,沒有菸味！非常棒！,0,0,0,1,0,0
3291,不附早餐 無法給評 地理位置 是我要的 特別好 管家親切 熱心 有禮貌 3D浮雕很漂亮,1,1,0,0,0,0
3294,沒有浴缸，非常驚訝，而且枕頭的舒適度略顯不足,0,0,0,0,2,0
3295,老闆很親切、空間寬敞乾淨、CP值高、有電梯。,1,0,1,1,1,1
3296,早餐的麵包有點乾,2,0,0,0,0,0
3297,安靜，交通方便，房間不大、簡單，無冰箱及 飲水設施（只有兩瓶水）。,0,1,0,0,2,0
3298,1. 離三多商圈捷運站很近，附近也有youbike站,0,1,0,0,0,0
3299,床邊的小桌子後還有點灰塵,0,0,0,2,2,0
3300,太多躁音床太老舊床頭燈損壞,0,0,0,0,2,0
3302,下午茶早餐都超讚,1,0,0,0,0,0
3303,住宿的品質.員工的接待態度.後續處裡的方式,0,0,0,0,0,0
3305,早餐很不錯，感覺非常用心。房間非常寬敞，三張單人床都是加大的，睡起來很舒服，每張床都有床頭櫃附設插座，滿足大家3C產品充電的需求。沙發也很大坐起來很舒服。浴室也很寬敞，洗澡的熱水很穩定，廁所有兩個洗手台，可以讓兩個人同時盥洗，早上趕時間的時候非常方便。整體而言非常乾淨舒適，價格也不高，下次去花壇會想再入住。,1,0,1,1,1,0
3307,房間明亮乾淨，床位有拉簾可遮光，有吹風機可以在房間吹頭髮，房間內還有榻榻米可以坐著休息看書。,0,0,0,1,1,0
3308,"1.當天比較晚入住,大姐還有關心晚餐有沒有吃,我腳比較大還幫我找合適的拖鞋",1,0,0,0,0,0
3309,房間大又乾淨,0,0,0,1,1,0
3310,環境很乾淨，設備很好，整體很棒，下次還想再住 ????,0,0,0,1,1,0
3312,早饭加一些面包之类的面食就更好了。,2,0,0,0,0,0
