id,reviews,service,location,value,cleanliness,room,facilities
1679,房間不大，備品給的大方，也有嬰兒備品。每層樓都有飲水機很方便。櫃台人員服務很親切。床是硬的好睡。地理位置佳，走路就可以到老街。,1,1,0,0,1,1
1682,冷氣超級吵，桌子很多灰塵,0,0,0,2,2,0
1684,小蓁接洽服務親切，很仔細的介紹民宿環境,1,0,0,0,0,0
1685,床很大很好睡，早餐樣式多樣也好食。,1,0,0,0,1,0
1686,老闆貼心服務 熱情分享、夫妻都很好聊 咖啡好喝，幸運的話還能喝到老闆珍藏好茶。,1,0,0,0,0,0
1688,地理位置不错，对面就是租潜泳器材的店，很方便。附近还有一些扁食店离得比较近。安排自由行的时候老板主动帮忙叫车，帮助我们安排。这次离开的时候自己把外套落在了宾馆，老板帮忙邮寄，贴心。,1,1,0,0,0,0
1689,客房乾淨，東西齊全，冷氣夠冷，熱水夠熱，水壓足，餐飲變化多,1,0,0,1,1,0
1690,床鋪很舒適、早餐也很好、服務人員態度也很棒,1,0,0,0,1,0
1691,早餐有現打豆漿和咖啡 非常好喝 老闆很有人情味 也推薦很多好地方,1,0,0,0,0,0
1692,民宿主人非常親切，像是與朋友分享生活的感覺，一抵達就先為客人準備咖啡,1,0,0,0,0,0
1693,老板娘好漂亮呀！！人又超贴心超好的！我们晚到还帮我们提早开空调～帮我们介绍附近东大门吃的店店～还送了小礼物 早上包含了早餐～出门就是大海景……就是很可惜 天气不太好 我们也急着花莲的一日游下次来我还要住！,1,1,0,0,0,0
1694,床有很明顯的灰塵，牆上有螞蟻窩，地上有蜘蛛，冷氣會漏水,0,0,0,2,2,0
1696,三樓淋浴間水管阻塞水下不去,0,0,0,0,2,0
1697,付費不方便.刷卡要到1館刷.服務員就要求我付現,2,0,0,0,0,0
1698,棒的住宿和行程體驗。感謝老闆/老闆娘：）,0,0,0,0,0,0
1699,1.衛浴空間略小,0,0,0,0,2,0
1700,有貓咪！而且床很好睡,0,0,0,0,1,0
1701,老闆和員工很和藹可親,1,0,0,0,0,0
1702,床有點硬，廁所雖然大，但蓮蓬頭是靠近門，洗完澡後腳還是要踏到水,0,0,0,0,2,0
1705,老闆麻將打的很好 人又熱情 且結合塔羅牌老師 不管是休息還是解惑 的好去處唷！,1,0,0,0,0,0
1708,可能房客有在房間抽煙，導致廁所抽風機會有煙味冒出，導致廁所充滿煙味，感覺不適。,0,0,0,2,2,0
1709,位置，週邊生活機能很便利,0,1,0,0,0,0
1710,老闆人很親切，十分照顧人，如家人一般款待我,1,0,0,0,0,0
1711,過渡去小琉球前一夜住宿，飯店太老舊 親子房煙味超重，下次不會選這家,0,0,0,2,2,0
1712,早餐意外的好吃又豐富,1,0,0,0,0,0
1714,不方便停車,0,0,0,0,0,2
1717,冷氣不太涼，常常睡到一半被熱醒（或是棉被太厚了？）,0,0,0,0,2,0
1718,房間很大，乾淨，早餐還不錯~,1,0,0,1,1,0
1719,每次都像回家一樣的感覺,0,0,0,0,0,0
1723,民宿老闆娘非常熱情,1,0,0,0,0,0
1726,那天早上11:00下雨，本來就只能放完行李，等下午3點入住，結果小管家很有彈性的讓我入住，並且詢問我此次來想去的地方，交通等等。我很開心，感覺很有人情味。,1,0,0,0,0,0
1727,老闆服務態度親切、房間寬敞 舒適,1,0,0,0,1,0
1728,位置方便適宜,0,1,0,0,0,0
1729,老闆還不錯早上還準備早餐,1,0,0,0,0,0
1733,平日價格便宜，環境很好，接觸到的員工不同時段這兩位都很不錯，介紹很仔細也很,1,0,1,0,0,0
1734,CP 值不錯,0,0,1,0,0,0
1737,沒有提供早餐只有提供便利商店兌換券,2,0,0,0,0,0
1738,民宿主人非常好，提供騎單車的人超乎預期的服務和協助,1,0,0,0,0,0
1741,早餐好吃，算是豐盛！,1,0,0,0,0,0
1742,工業風的感覺,0,0,0,0,0,0
1743,在booking網站上登住宿照片與實際不符，他們用獨棟住房美照，讓你住國聯二路舊小套房，但我們是看照片選住房，booking給的照片及住址，一起傳給我，因不符，去電老闆口氣很沖，說是妳選的，說花蓮有1萬多間民宿，妳可不住。,2,0,0,0,0,0
1744,真的很感謝老闆（或是小幫手？）一路carry，因為訂房網站的問題衍生了一些小問題，老闆也是很盡力的協助真的非常感謝，愉快的玩了兩天台南,1,0,0,0,0,0
1745,地理位置方便，停車場很大，不用擔心沒車位,0,1,0,0,0,1
1748,早餐是麥當勞餐券，走路3分鐘左右就到了。,0,0,0,0,0,0
1749,房間裡没有冰箱，浴室没有浴缸，只能冲澡，如果另外需要瓶装礦泉水，要額外收費。,0,0,0,0,2,0
1750,老闆&老闆娘親切熱情,1,0,0,0,0,0
1752,床很好睡很舒服！早餐真的好吃耶！而且很貼心的會送到房間^_^,1,0,0,0,1,0
1753,早餐跟消夜太豐富了，肚皮都快撐破啦！,1,0,0,0,0,0
1756,大致上可以,0,0,0,0,0,0
1757,民宿主人很親切，有問必答，還會推薦附近景點cp值高的飲食，房間很乾凈住起來也很舒服，下次再來會想再來住宿，也會推薦給好朋友的，謝謝囉！,1,0,0,1,1,0
1758,有浴缸，有停車位,0,0,0,0,1,1
1759,床很舒服，一樓咖啡廳在非營業時間是提供旅客休息，覺得超棒。,0,0,0,0,1,1
1760,早餐豐富，服務人員熱心,1,0,0,0,0,0
1761,房間有很重的煙味，廁所很臭有屎味，隔音不是很好,0,0,0,2,2,0
1762,位置離車站很近，附近很熱鬧,0,1,0,0,0,0
1763,居住地方離愛河很近，要去各地方也很方便,0,1,0,0,0,0
1764,早餐很丰盛，很温馨，有家的味道。店主小姐姐，超级棒，非常热心的给我们讲解入住指南，分享当地的美食，帮我们叫车，临走前还赠送我们小礼物，非常感谢。最后还有一分是给热情的小狗狗的，一进门就围着我们，真的超可爱。,1,0,0,0,0,0
1765,房床很舒適，空間大,0,0,0,0,1,0
1766,房間設施超讚，超棒海景，服務人員親切，餐點好好吃～,1,0,0,0,1,0
1767,冷氣有點大聲，開了超過半小時仍然不涼,0,0,0,0,2,0
1768,1.房間的隔音設備比較差,0,0,0,0,2,0
1769,房間內無冰箱,0,0,0,0,2,0
1771,，服務人員會時時留意客人及餐點狀況，稍不足的的地方，還是客房略小隔音不好。,1,0,0,0,2,0
1772,老闆人很好～會介紹景點跟美食給我們！房間、浴室也都很乾淨！,1,0,0,1,1,0
1773,沒有附設停車場（周邊雖有許多停車場，平均收費$20/30min不便宜）。,0,0,0,0,0,2
1774,老闆娘親切熱心，態度非常好,1,0,0,0,0,0
1775,公共空間很不錯,0,0,0,0,0,1
1779,房間有電腦 飲水機 設備非常好,0,0,0,0,1,0
1781,地理位置好，702房視野好（面對車站）,0,1,0,0,1,0
1782,有陽臺的空間和晾曬衣架的設施，方便多日旅住。,0,0,0,0,1,0
1785,1.冰箱強度較不足。,0,0,0,0,2,0
1786,早餐很用心（老闆也會關心是否有吃飽）,1,0,0,0,0,0
1787,房務的部分非常乾淨，外觀設計有感覺，內部小巧乾淨！很適合家庭、夫妻出遊！,0,0,0,1,1,0
1789,但基本的都有(稀飯、滷肉飯、吐司、饅頭、 蛋餅、湯、飲料、炸物),0,0,0,0,0,0
1790,老闆在浴室放了很香的植物，雖然濃郁卻很天然，很舒服~,0,0,0,0,1,0
1791,床頭沒有插座讓我很困擾,0,0,0,0,2,0
1792,以近兩千的房型來說不論是房間大小，相關硬體設備都令人頗失望。插座很少，商務使用難以滿足需求。房間也很狹小，且老舊屋子改裝並沒有人用電梯。,0,0,2,0,2,2
1793,上鋪冷氣出口感覺沒做清理，入住後可看到灰塵隨風飄揚，直打噴嚏,0,0,0,2,2,0
1794,位置地點方便讓人覺得滿意,0,1,0,0,0,0
1796,民宿整體營造氣氛悠閒自在，很適合想放鬆渡假的人。,0,0,0,0,0,0
1798,接待處就有提供冰品及咖啡熱飲品24小時吃到飽非假日房價還有贈送簡單的宵夜晚餐。,1,0,0,0,0,0
1799,"地點鬧中取靜,飲食方便",0,1,0,0,0,0
1800,早餐是不錯吃！,1,0,0,0,0,0
1801,房間view很美，晚上還可以看到水舞秀,0,0,0,0,1,0
1802,1.餐廳的菜色與新鮮度，服務人員的用心，住兩天有換菜色,1,0,0,0,0,0
1803,房間可以看到無人機表演，正中間的位置視野一級棒，飯店安排的很貼心,0,0,0,0,1,0
1804,老闆娘非常親切，也很客氣，有回到老家的感覺,1,0,0,0,0,0
1807,老闆與老闆娘非常親切～,1,0,0,0,0,0
1808,吹風機熱度夠但風太小，頭髮較長必須吹很久,0,0,0,0,2,0
1810,緊鄰太平洋的檜木民宿，環境美麗，住宿寬敞，開窗迎臨無敵海景，是放鬆舒壓的好地方,0,1,0,0,1,0
1811,不知道是不是飯店住客減少了。所以晚班只有一位服務人員。我從六點多打電話想詢問是否有床圍。都沒人接。雖然後面有回電給我⋯但是我真的打很多通。,2,0,0,0,0,0
1812,床頭靠近電話那邊 有一股味道 需改善一下 謝謝,0,0,0,2,2,0
1814,地點不錯..房間乾淨..老闆很親切,1,1,0,1,1,0
1815,房間乾淨舒服，床也好睡，民宿離市中心很近，絕對是來金門住宿的好選擇 ,0,1,0,1,1,0
1820,親子房空間很大，很夠小朋友消耗體力,0,0,0,0,1,0
1822,房間及浴室有點小,0,0,0,0,2,0
1823,一大早被當天暗錯電鈴的團客給吵醒，狂按還狂敲門……。其餘還好。,0,0,0,0,0,0
1824,可以接受，很不錯,0,0,0,0,0,0
1826,地點清幽安靜，離朝日溫泉近，附近晚間即可看到陸蟹過馬路，騎機車要放慢小心。,0,1,0,0,0,0
1827,有附早餐，卻未告知使用時間於10：30過後就不提供，不介意有沒有那份早餐而是感覺較不好，如主動告知會更好，謝謝,2,0,0,0,0,0
1829,水壓太小，洗澡不便,0,0,0,0,2,0
1831,早餐不好吃，很失望，東西很少～吃起來也很粗糙，我個人覺得不值得花380台幣去吃。房間有個怪味。退房時後櫃檯沒人。,2,0,2,2,2,0
1832,原本是雙人床，尺寸確是單人加大的床。還有窗戶窗簾不夠長，遮不住陽光！,0,0,0,0,2,0
1833,非常放鬆 像在自己家一樣,0,0,0,0,0,0
1834,房间太小，行李放不开,0,0,0,0,2,0
1836,性價比高:D,0,0,1,0,0,0
1837,有電梯可搭，房間乾淨,0,0,0,1,1,1
1838,床頭附近沒有插座,0,0,0,0,2,0
1839,入住當天廁所有點問題 ，反應櫃臺有派人上來查看 。雖然無法當場解決 ，算還有誠意 。雖然還是沒解決馬桶的問題 。,1,0,0,0,2,0
1841,地點很方便我們一早去划獨木舟，房間佈置很溫馨，應有盡有,0,1,0,0,1,0
1842,地點上，交通直接且方便,0,1,0,0,0,0
1844,冷氣一直抖抖抖 可能要修一下,0,0,0,0,2,0
1845,房內有冷熱湯池，很棒,0,0,0,0,1,0
1846,入住有點心、宵夜和早餐，休旅車有戶外的平面車位 員工的服務一極棒',1,0,0,0,0,1
1847,民宿離市區，車站近又方便，房間乾淨，床好睡，住起來很棒，老闆娘親切人好好，耐心回答我們的問題，CP值高，值得推薦,1,1,1,1,1,0
1848,一開始找不到早餐店，繞了好久。早餐店人內爆多，還好找得到座位塞進去~,0,0,0,0,0,0
1849,位置方便，但第一次去不好找，建議早點到，還可以跟老闆多聊聊。,0,1,0,0,0,0
1850,房間空間大及乾淨浴室、民宿阿姨非常熱情有禮貌、都站在旅客需求角度主動提供協助、會推薦給朋友、也會再次入住！,1,0,0,1,1,0
1852,地下室的房型蚊子有夠多 室內空調也太冷 房間乾淨度有待加強 不會再訪,0,0,0,2,2,0
1853,很不錯的地方，大毛小孩來，房間陽台區還有一塊草皮，很讚。,0,0,0,0,1,0
1854,對面的綠島呢！房數不多，老闆對品質要求看的到！是愉快的休假的好地方！,0,0,0,0,0,0
1856,一晚350真的蠻便宜的，房間還行,0,0,1,0,1,0
1857,"沒有,整體都很棒",0,0,0,0,0,0
1860,(也不到不滿意，就是小地方有改善會更好～),0,0,0,0,0,0
1863,位置真的很方便，走路就可到美食街覓食。,0,1,0,0,0,0
1865,老闆很親切友善，並且熱心協助房客問題。,1,0,0,0,0,0
1866,早餐只有中式粥和小菜而已，希望能提供豆漿或咖啡等沖泡飲品。,2,0,0,0,0,0
1867,房間很乾淨，設備很新穎,0,0,0,1,1,0
1868,床很舒適，房間落地窗一眼望出去可以看見整片的農田，另一邊窗戶可看見綠油油的高山，讓人心情開朗。老闆很好，請我們吃自種的水果。房間內的木頭地板和浴室的木頭天花板讓人心情很放鬆。沖澡非常舒服。,1,0,0,0,1,0
1870,早餐真的不錯喔～,1,0,0,0,0,0
1871,小而美的居住空間，離中西區景點都近！就在蜷尾家後面巷子！推推,0,1,0,0,1,0
1872,床很好睡，風景很漂亮，冷氣很舒服。浴室的蒸氣很舒服,0,0,0,0,1,0
1873,早餐多樣化，很不錯。,1,0,0,0,0,0
1874,民宿風格獨特，中古蛋四人房更是有趣，那個大蛋床很舒服，小朋友超喜歡。,0,0,0,0,1,0
1876,"早餐方便,預先告知櫃檯可以提早領取",1,0,0,0,0,0
1877,位置真的挺不好找，花了不少時間,0,2,0,0,0,0
1878,房間內的馬桶不好沖。,0,0,0,0,2,0
1879,1. 房間座椅多，滿滿的木製傢俱。,0,0,0,0,1,0
1880,主題小木馬真的可愛,0,0,0,0,0,0
1883,早餐餐點有進步空間,2,0,0,0,0,0
1886,其餘都很好也很用心！尤其喜歡自助式入住XD,0,0,0,0,0,0
1889,1.提供了中西式早餐，足以滿足住客需求。,1,0,0,0,0,0
1890,卫生间太小，安全灯位置不合理，影响睡眠,0,0,0,0,2,0
1891,工作人員真的很親切！！！,1,0,0,0,0,0
1892,床很舒服，能夠睡好,0,0,0,0,1,0
1894,如果是4星酒店规模再大点就好。,0,0,0,0,0,0
1896,1、住宿的306，不僅漏水、且還漏了二處,0,0,0,0,2,0
1897,房門不會自動關上，所以要注意。由於洗手台只有簡單隔開，容易打擾到已經入睡的同行者。,0,0,0,0,2,0
1898,早餐種類不多，不過蠻好吃的,1,0,0,0,0,0
1899,房間價位與服務內容很合理 很貼心幫太魯閣馬拉松選手準備賽後專屬淋浴房間還有飲料,1,0,1,0,0,0
1900,民宿老闆人很好 地理位置也方便 價格優惠 房間乾淨 廁所乾濕分離,1,1,1,1,1,0
1901,目前看沒有,0,0,0,0,0,0
1903,早餐豐富又好吃，房間浴室乾淨，有暖氣很舒適，景觀非常美~,1,0,0,1,1,0
1904,"房間空間舒適,燈光美.氣氛佳",0,0,0,0,1,0
1905,床很大舒適、進出磁卡感應、cp值算不錯,0,0,1,0,1,0
1907,CP值高，又和善,1,0,1,0,0,0
1908,有洗衣機還有地方曬衣服...對環島的旅客幫助很大,0,0,0,0,0,1
1910,飯店人員態度很好，早餐比較簡單，飯店位置離夜市與捷運站很近,1,1,0,0,0,0
1912,床很舒服，人員服務很好~,1,0,0,0,1,0
1913,浴室的設計不ok及有煙味，可能是顧客在房內抽沒有散發掉,0,0,0,2,2,0
1914,民宿主人人很好,1,0,0,0,0,0
1915,沒停車的地方，不太方便 晚上洗澡水壓很低，來自日本客人的抱怨,0,0,0,0,2,2
1916,有電毯再冬天很有幫助,0,0,0,0,1,0
1919,夜景真的超漂亮,0,0,0,0,1,0
1922,CP值算不錯的飯店,0,0,1,0,0,0
1923,目前找不到不滿意的地方,0,0,0,0,0,0
1924,CP值高，老闆很好，有家的感覺！,1,0,1,0,0,0
1926,早餐是老司機熱壓土司放在房間門口，有免治馬桶和膠囊咖啡可以使用，房間大。,0,0,0,0,1,0
1927,早餐可以改進～另外整潔度需要加強，房間很多蟲子，甚至出現蟑螂！,2,0,0,2,2,0
1928,位置地點蠻便利,0,1,0,0,0,0
1929,民宿的環境離東華大學及花蓮車站都算近，重點是離花蓮星巴克也不到10分鐘的車程！,0,1,0,0,0,0
1930,房間位置離六合夜市很近，去哪裡都很方便,0,1,0,0,0,0
1932,牙刷有點硬,0,0,0,0,2,0
1933,沒有熱水的問題處理好久,0,0,0,0,2,0
1934,沒有第四台隔音不太好,0,0,0,0,2,0
1936,冷氣聲音有點大聲，而且不涼。如果能改善冷氣問題，會是很好的住宿。,0,0,0,0,2,0
1937,民宿熱情招待泡茶.介紹附近景點.直接接送們去附近步道散步健行.,1,0,0,0,0,0
1939,"地點非常好,櫃台服務人員非常親切.給予良好的評價",1,1,0,0,0,0
1940,位置很方便～距離羅東夜市很近！民宿老闆很友善！退房時因為太急、太匆忙，我們把鑰匙放在信箱裡，不確定老闆有沒有看到，也忘了提醒老闆，希望沒有造成困擾～,1,1,0,0,0,0
1941,老闆娘親切大方，手作早餐很好吃！有機會會再回訪,1,0,0,0,0,0
1942,房間內壓迫感稍微重了點，加上我可能身高比較高的關係，個人床位睡起來有點不舒服！,0,0,0,0,2,0
1943,可能是因為疫情的關係沒有提供早餐，也希望能有腳踏車可以逛逛公園。,0,0,0,0,0,2
1945,房間乾淨、安靜、老闆娘熱情介紹台南附近的景點.也會關心房客什麼時候入住時間。推薦,1,0,0,1,1,0
1947,（1）地點非常市區，停完車就可以步行出門,0,1,0,0,0,0
1948,早餐非常豐盛,1,0,0,0,0,0
1949,床太軟，冷氣太強無法調弱,0,0,0,0,2,0
1950,老闆和老闆娘人很好！,1,0,0,0,0,0
1951,地點很好房間寬敞,0,1,0,0,1,0
1953,太晚回來被反鎖在外面，打電話門鈴也沒人接拖了很久，老闆的妹妹才來開門，一早跟老闆反應超冷，居然碰壁⋯⋯,2,0,0,0,0,0
1955,只有部分房型在阿里巴巴二館，室內停車格有限，只有2個位子，二館房子後面雖然還有停車格，但是路很窄，車子要停進去不方便，其餘的房客全都要自己找路邊停車，建議要訂房的房客先確認清楚再訂房,0,0,0,0,0,2
1956,早餐，清粥小菜,0,0,0,0,0,0
1957,主人們非常親切熱心，會詳細介紹好吃好玩的給我們，甚至還幫忙打電話訂了超難訂的炸蛋蔥油餅，我們還因為在房間睡死了忘記在指定時間去拿，讓民宿主人一直被提醒實在很不好意思...,1,0,0,0,0,0
1958,地點方便，面向科技園，左邊是零售美食小店林立，離火車站也只是10幾分鐘的路程。,0,1,0,0,0,0
1960,體驗在地生活超棒的，民宿也歡迎各國朋友光臨,0,0,0,0,0,0
1961,床非常之硬,0,0,0,0,2,0
1962,有sauna設施非常棒,0,0,0,0,0,1
1963,位置差了一點,0,2,0,0,0,0
1965,專業茶及柚子的農場！請大家一定要來,0,0,0,0,0,0
1966,有停車場。床很舒適，枕頭好睡。地理位置方便，去哪開車都很近。,0,1,0,0,1,1
1968,床太軟，易晃動,0,0,0,0,2,0
1971,"三人房連假價格才1800元,還有超豐盛的早餐,老闆和老闆娘也很親切,讓人感覺很舒服~",1,0,1,0,0,0
1972,房間很大很舒適又乾淨!,0,0,0,1,1,0
1973,早餐不錯，房間大，附近7-11，全聯，買吃的也方便,1,1,0,0,1,0
1974,沒什麼不喜歡的,0,0,0,0,0,0
1975,老闆娘熱情招呼，餐飲頗佳。,1,0,0,0,0,0
1976,房間乾淨舒適，空間大，老闆娘很親切，早餐好吃份量也很足,1,0,0,1,1,0
1977,冰箱壞掉裡面發霉,0,0,0,0,2,0
1978,離大發工業區很近 方便臨時住宿,0,1,0,0,0,0
1981,床很好睡 老闆娘親切,1,0,0,0,1,0
1982,老闆跟老闆娘人很好，還簡單介紹了附近的景點。大廳有免費零食跟水可以自取，也有另外提供簡便的早餐（吐司）和微波爐、烤箱等等，覺得很棒！,1,0,0,0,0,1
1983,房間（二衛二浴）,0,0,0,0,0,0
1984,很適合潛水的人居住的地方！讚！,0,0,0,0,0,0
1986,公共空間及設施,0,0,0,0,0,0
1987,全部都喜歡，完全沒有雷，嬰兒床也很新很乾淨，床的軟硬剛好，睡起來不會腰酸背痛，浴室寬敞舒適、浴缸超級無敵大，七樓兒童遊戲區還有免費飲料糖果可以拿，也太貼心了整體乾淨整潔明亮寬敞舒適,0,0,0,1,1,1
1988,住宿房間寬敞乾凈，床好睡,0,0,0,1,1,0
1990,冷氣沒辦法調節，問題多，勿採地雷....3280不便宜，品質值1280,0,0,2,0,2,0
1992,離機場近，搭機場巴士附近也有站牌,0,1,0,0,0,0
1993,地理位置好，去很多地方都方便！晚上附近小吃跟酒吧也都有對面有一間海綿蛋糕店，味道很香，吃起來滿普通的房間很普通，很老舊！沙發也都破破爛爛的而且，隔音很不好！….一直可以聽到隔壁的聲音，採光也很普通浴室的空間也滿小的…就是一間普通！但地理位置佳的酒店CP值還行，不算貴…,0,1,1,0,2,0
1995,床還蠻舒適的，整體房間佈置得溫馨，接待人員很有耐心講解，態度很好。,1,0,0,0,1,0
1996,有小螞蟻，而廁所有沼氣味。,0,0,0,2,2,0
1998,沒有！！！,0,0,0,0,0,0
1999,沒有什麼不滿意的，只是工作人員很像只有老闆一人辛苦了！,0,0,0,0,0,0
2001,早餐精緻，不錯！,1,0,0,0,0,0
2002,房内很整潔。這次浴室没浴缸，小了点，上次有浴缸較大。,0,0,0,1,1,0
2004,房務服務人員的態度非常好，住宿當日因使用的筆電系統原因，無法連線WiFi，致電予櫃檯後，馬上送網路線至房間，真的令人感動。,1,0,0,0,0,0
2005,房間很大，床舒適，熱水足,0,0,0,0,1,0
2006,房間空間寬敞，洗髮精、沐浴乳都用環保式上架,0,0,0,0,1,0
2007,價格親民，房間乾淨，設施齊全，雖然浴室不大間，但整體來說是很不錯的旅店，值得推薦,0,0,1,1,1,0
2008,美麗老闆熱情招呼介紹、細心解說內裝設備 彷彿朋友親切招呼，很放鬆享受的難忘假期～,1,0,0,0,0,0
2009,早餐選擇豐富,1,0,0,0,0,0
2010,地點佳，有腳踏車可以租借很方便,0,1,0,0,0,1
2011,"房內電視訊號不好/泡澡區的電視無法收看,",0,0,0,0,2,0
2012,老闆人很好很親切，下次有去花蓮還會選擇這裡,1,0,0,0,0,0
2013,床舒適 空調舒服,0,0,0,0,1,0
2014,共用空間很讚,0,0,0,0,0,1
2015,位子在湖邊，可以就近開表演活動,0,1,0,0,0,0
2016,大樓入口及看板不太顯眼，花了點時間找,0,0,0,0,0,0
2017,早餐沒有水果,2,0,0,0,0,0
2019,床超好睡超舒服,0,0,0,0,1,0
2020,浴室水龍頭還會晃動，雖然不影響使用， 但影響入住的感受，花了錢卻住到這種房間。,0,0,0,0,2,0
2022,完全是我的風格！飯店很新很乾淨，進房燈光很有氣氛，超愛廁所的部分，很享受裡面的氛圍。,0,0,0,1,1,0
2023,房間內的床好舒適,0,0,0,0,1,0
2025,下午茶不佳,2,0,0,0,0,0
2026,床鋪睡起來真的很舒服，整體設計感也好看，跟照片差不多。服務態度也很親切。而且就在崛江裡面超方便！下次有機會還會再入住。,1,1,0,0,1,0
2027,房間可以看到戶外的景觀 浴池夠大的、又包含了早餐超讚 的選擇,1,0,0,0,1,0
2029,就可以適應了 帳篷透明的地方照天氣好也看不到星空 有早餐～就傳統的早餐店早餐,0,0,0,0,0,0
2030,"房东夫妻非常热心，两天晚上都陪我们喝茶聊天，准备了很多水果、零食等请我们随时品尝，离开的时候还为我们准备了慢慢一袋的食品让我们在路上吃；房间非常干净整洁,很有童趣，一起都很完美。",1,0,0,1,1,0
2031,房間有點小，電視的位置很怪不知道坐哪裡看。,0,0,0,0,2,0
2032,民宿接待人員很親切，房間很大 床很舒適,1,0,0,0,1,0
2034,"早餐很好,住宿地點也適中",1,1,0,0,0,0
2036,地理位置好， 房間寬敞舒適，如能再一個梳妝台就更好了,0,1,0,0,1,0
2037,價格適中，房東熱情。可惜隔音不足，房內沒有電視。有進步地方,1,0,1,0,2,0
2039,房間很乾淨半夜很寧靜，早餐很好吃，晚上入住後，走路就能到賴桑壽司店跟大遠百吃飯逛街，最喜歡的浴缸很大，床跟毛毛毯都好睡,1,1,0,1,1,0
2040,房間空氣環境都很乾淨,0,0,0,1,1,0
2042,半夜火警警鈴大作,0,0,0,0,0,0
2043,地理位置離夜市很近！附近美食很多！,0,1,0,0,0,0
2044,夜餐很安靜…隔音比想像中的好…床鋪和冷氣都很ok…老板很親切,1,0,0,0,1,0
2045,沖澡水量小、早餐陽春，很可惜,2,0,0,0,2,0
2046,地點靠近市區，房東人很好，可提前入住及寄放行李，房間乾淨整潔,1,1,0,1,1,0
2048,住宿點不錯，買吃的方便，又有停車場,0,1,0,0,0,1
2049,床稍微有點異音，不過可接受,0,0,0,0,2,0
2050,房間很大很乾淨，床也好睡,0,0,0,1,1,0
2051,床太彈了，隨便動一下身邊的人都感覺的到。,0,0,0,0,2,0
2052,房間很寬敞,0,0,0,0,1,0
2053,老闆娘盧小姐人有很親切，解說附近與房間設施都很清楚。,1,0,0,0,0,0
2054,早餐不錯，浴缸大，免治馬桶，小孩愛,1,0,0,0,1,0
2055,因疫情關係，飯店外牆仍在整修施工,0,0,0,0,0,0
2056,有電梯 真的很酷,0,0,0,0,0,1
2057,房間空間大舒適乾淨，床很好睡，老闆親切會提供附近旅遊建議，早餐好吃，貓咪和狗很可愛,1,0,0,1,1,0
2059,房間很乾淨又很大舒適，已回住很多次了,0,0,0,1,1,0
2060,"民宿很新，超赞的工业风设计，步行三两分钟即可到达七星潭。老板超nice,还免费帮忙升级三楼海景房，房间干净整洁，床也很舒服。还有早餐也很棒！可以说是本次台湾游入住体验最棒的一家民宿了！因为带了两个小朋友，取消了山海一日游计划，只在花莲匆匆待了一晚。希望下次有机会再来！",1,1,0,1,1,0
2061,早餐雖然不像一般飯店是自助式吃到飽，,0,0,0,0,0,0
2063,沒有哦！我很滿意，謝謝老闆,0,0,0,0,0,0
2065,位於金門縣金城鎮新興區域，商家集中，吃過晚餐後可以放鬆散步。,0,1,0,0,0,0
2067,性價比超高 便宜,0,0,1,0,0,0
2068,可惜早餐是08:00才開始，針對商務需要早點出門的旅客食用不到,2,0,0,0,0,0
2069,其餘都舒適！很好,0,0,0,0,0,0
2070,老闆人好，對當地熟，住宿便宜，給了很棒的旅遊建議，令人放鬆的地方,1,0,1,0,0,0
2071,老闆娘待人親切，廚藝一級棒，桂竹筍?，山豬皮Q，尤其是紅茶滷肉非常好吃。,1,0,0,0,0,0
2072,老闆娘很熱心，早餐超好吃的～～,1,0,0,0,0,0
2075,床底整潔需留意,0,0,0,2,2,0
2078,民宿很乾淨整潔，冰箱在一樓是共用的，管家人也很好會推薦我們去哪邊玩 床很舒服 直接睡死,1,0,0,1,1,0
